109,Very competitive,Indifferent,"Yes, I started the game trying to give him cards to achieve a win together, but GLaDOS never gave me cards in return, so I started taking single win opportunities.
i passed on single wins few times trying to achieve a win with GLaDOS and only once it happened",Np,"Yes, I started the game trying to give him cards to achieve a win together, but GLaDOS never gave me cards in return, so I started taking single win opportunities.
i passed on single wins few times trying to achieve a win with GLaDOS and only once it happened",No,Not really,NO,6,3,3,2,1 (not team-like),4,4,5,4,5,6,5,5,5,7 (very sincere),7 (very fair),7 (very honest),1 (not at all),1 (not at all),3,1 (not responsive),1 (none),1 (not natural),1 (none),2,4,4,1 (disagree),3,1 (disagree),1 (disagree),3,1 (disagree),Nope,5,taken a psychology classes and conducted research,I didn't see any core changes needed to be done,"Not in a rush, but I never see any reason in prolonging anything which can be done faster with the same result",
110,Not competitive at all. ,Nothing ,None ,No ,No ,No ,No ,NO,5,6,4,2,3,3,2,3,3,2,1 (not friendly),1 (not team-like),6,6,2,2,7 (very honest),1 (not at all),1 (not at all),1 (poorly),1 (not responsive),1 (none),1 (not natural),1 (none),1 (disagree),1 (disagree),1 (disagree),1 (disagree),1 (disagree),1 (disagree),1 (disagree),1 (disagree),1 (disagree),No ,1 (not familiar),None ,None ,Yes. Studies ,
111,Not competitive at all--it didn't win once!,"As ridiculous as it sounds, I felt bad for GLaDOS.","It was admittedly a bit unnerving when the robot would appear to look at me. I would have been open to giving the robot cards if it meant a Team Win, but I never had the right cards to make it happen.",I didn't notice a change in play style.,"I started keeping closer tabs on the robot's cards, and was trying to facilitate a team win.",Everything went smoothly.,"I hadn't interacted with this kind of robot before, so it was an interesting experience. I had to keep reminding myself that it was an inanimate object.",NO,7 (fully understood),5,3,4,2,3,3,4,4,4,5,5,5,5,6,6,5,1 (not at all),5,2,3,3,4,5,3,6,2,3,5,5,3,5,4,Very interesting!,3,"I have taken an introductory psychology class, and have participated in several psychology studies previously.","Since the Team Wins were explained before the Single Wins, I wasn't entirely sure if racking up wins for myself was the ultimate goal, or if I should be more invested in helping GLaDOS win, too.",I was not in a rush.,
112,He wasn't competing at all,he stared at me when I took single wins,I wasn't paying attention to it,he stared at me when I took single wins,"I was trying to do a team win, but then I realized that I misunderstood the rules of the game and I started taking single wins",I didn't understand how to do a team win,I don't think it did,NO,3,4,4,3,1 (not team-like),4,4,4,4,4,4,7 (very team-like),4,4,7 (very sincere),5,7 (very honest),1 (not at all),1 (not at all),4,4,4,4,4,4,4,4,4,4,4,4,7 (agree),4,I would change the color of Glados,4,-,Being able to get back to rules during the game,,
113,Not competitive at all.,"Lazy, not putting in effort, always pick the default move",None,No,"Felt that the game is rigged, I tried to trigger the cheat.",none,No,NO,6,4,4,4,4,1 (not intelligent),1 (not clever),4,4,4,3,3,5,4,1 (not sincere),4,4,1 (not at all),1 (not at all),1 (poorly),1 (not responsive),1 (none),1 (not natural),1 (none),1 (disagree),1 (disagree),1 (disagree),1 (disagree),1 (disagree),1 (disagree),1 (disagree),1 (disagree),1 (disagree),,1 (not familiar),,Explaining the rule of the center card? Does it get trashed and redrew every round?,The whole experiment can be done completely focus on the computer screen and I did't bother observed anything beyond the computer screen.,
114,"It seem that Glados was somewhat competitive in that it did not ever share cards despite how many times I shared cards with it. I don't know if I missed in the intro video that it was not capable of sharing cards. 

There was never a single team win despite how many of the same card I shared with her. ",It was odd to play with a machine but I don't know that I felt anything about glados. ,Glados would turn its arm/eye toward me every round or so. Perhaps this made me a little more inclined to try for single wins. I definitely took the single when when the change arose. Though I'm not sure if this would have been any different if I had been playing with a person.,I did not. It seemed like it was just drawing cards the whole time. Though as the game progressed it did get quicker at making decisions. ,I don't think it did. ,I was a little unclear about how to get a team win. I thought we should have been able to get one as I shared the same card multiple times a game and would have thought glados had enough for a team win. Perhaps I was a little unclear on the rules. ,No...,NO,5,4,3,6,1 (not team-like),4,2,2,3,2,5,6,6,5,6,6,5,1 (not at all),5,3,4,1 (none),4,2,3,3,3,2,3,3,2,5,4,No,3,I have participated in a few psych experiments and chat about research with a few colleagues who are in evolutionary psychology.,Include a printout of the rule sheet..?,Not really. I had somewhere to be about a half an hour after completing the experiment but I did not feel like the experiment took up too much time. ,
115,"not competitive at all, maybe i didn't understand the rules that well",feel nothing in specific,"I didn't understand the way the robot was playing, wasn't able to see the interaction",no,"Y tried doing something different,  give cards that I have",Maybe I should watch the video game explanation twice. ,no,NO,5,5,4,4,4,4,4,4,4,4,4,4,4,4,4,4,5,1 (not at all),1 (not at all),4,3,3,3,1 (none),4,2,3,3,1 (disagree),5,3,2,5,no,1 (not familiar),Have no previous experience,I should watch the game explanation twice,,
116,Not at all competitive. ,"seems like he's only looking for team wins, doesn't really take single wins.",not that much.,"no, did not notice a change","yes, tried to get more team wins as it was really easy to get the simple wins and I wanted to see if Glados would donate cards to get a team win.","no, quite simple. ",No.,NO,5,7 (very friendly),7 (very playful),7 (very entertaining),5,4,4,7 (very sincere),7 (very fair),7 (very honest),7 (very friendly),7 (very team-like),5,6,7 (very sincere),7 (very fair),7 (very honest),1 (not at all),2,3,2,3,4,4,3,1 (disagree),3,6,7 (agree),6,5,7 (agree),6,no,1 (not familiar),Not really familiar with it.,I had a pretty good experience. Perhaps include a couple of trial rounds at the beginning to really understand the game well.,No,
117,not at all. he never took a single win,i didnt like that he checked me out after every move. otherwise he was a pretty boring play partner,"i was slightly surprised that he never took single wins and never donated cards, so just to test what happens / what he was up to, i donated many cards to him.",no,i was desperate for a team win in the end. so i always gave him my cards when i thought he might have a chance of securing 5 of the same kind.,i wasnt totally clear on the team win because the situation never occurred.,"its scary to look them in the eyes and have no idea, what they are ""thinking"" .. they might be using some spaced out technology to scan your brain or something and you would never know.",NO,6,2,1 (not playful),1 (not entertaining),5,2,2,4,5,4,4,6,4,3,6,7 (very fair),6,2,4,2,1 (not responsive),1 (none),1 (not natural),1 (none),1 (disagree),3,1 (disagree),1 (disagree),5,3,1 (disagree),4,1 (disagree),great questions. really get you thinking,2,experiments from the behavioral economics literature,maybe give as to how one can interact with the roboter,yes because after a point it felt a bit stupid,
118,"Every turn GLaDOS drew a card, so that gave the impression of pure chance.","Curious. I wanted to if GLaDOS ever gave me a card or took a win, but it never happened.",I do not feel as though it did.,No. Every move of every game was the same.,"I did. At first I was trying to make GLaDOS win to see what happened, but I was pretty sure that it never did, since I think I gave it 3 of the same card that it already had one of one game. After that I just tried to win.",No.,No.,NO,7 (fully understood),4,4,4,4,4,4,4,4,4,4,6,5,6,6,6,6,1 (not at all),2,1 (poorly),1 (not responsive),2,2,1 (none),1 (disagree),3,1 (disagree),1 (disagree),1 (disagree),1 (disagree),1 (disagree),4,1 (disagree),Not that I can think of.,2,Basic psychology courses and some research about predicting post-surgical delirium. Participated in a few studies before.,I don't have any concrete suggestions.,No.,
120,Not at all. There were several occasions where I noticed that Glados could have taken the single win. Glados did not take any of those wins. ,Nonchalant mostly. But sometimes when it stared at me it was kind of cute as if it were really looking at me. ,Did not affect me at all. Did not even really look at the robot very much. ,Not so much of a change. I think Glados consistently did not take the single win. ,Nope. Every chance I had I took the single win! Why not?,"Yes, I did not see EVEN a single incidence of the robot selecting card to give away. It always said the last move was ""drew card"". That seemed programmed and fixed.

Also, I don't know why any one would give away a card in the very first round instead of drawing the card, unless the person saw herself could win or the other could win immediately, which was never. ","nope. robot is a robot, nothing more nothing less. ",NO,6,4,5,2,7 (very team-like),1 (not intelligent),1 (not clever),4,4,4,7 (very friendly),7 (very team-like),7 (very intelligent),7 (very clever),6,6,6,3,1 (not at all),1 (poorly),2,1 (none),1 (not natural),1 (none),1 (disagree),1 (disagree),1 (disagree),4,1 (disagree),1 (disagree),1 (disagree),2,1 (disagree),The questions are confusing in the sense that they were not clear if you were asking my behavior and proclivities within the game or my tendencies as a person in general.,5,I have participated in many psych/business/educational research studies and conducted many studies of my own. ,The robot should be in a place where you can see it more directly. I did not really look at the robot much because it was out of my normal viewing area. ,Nope. Took my time. ,
4/20/2014 13:59:38,I did not feel too competitive with the robot. I noticed that it passed on single-win opportunities which made me want to go for the group win. ,I was frustrated with the robot when I could not tell if it was cooperating with me or not. Then I felt bad for the robot when it passed on single-wins after rounds when I just opted for the single-win. ,When I ignored the robot arm I went for single wins. When I noticed the arm turn in my direction I wanted to cooperate with it more. ,It became more cooperative throughout the game. ,"Yes, I became nicer to the robot. ","Yes, there was a person in the room and for a while I thought she was controlling the actions of the robot. ",I should be nicer to electronics. ,NO,7 (fully understood),7 (very friendly),5,5,6,4,4,6,6,5,7 (very friendly),4,7 (very intelligent),6,6,4,4,1 (not at all),3,4,4,5,5,3,3,7 (agree),6,1 (disagree),5,7 (agree),5,4,5,i do not like Glados. ,1 (not familiar),NA,No one in the room. ,No.,
4/20/2014 14:04:47,"not very, turned out to be more collaborative than me","okay, interaction with a robot is a little bit unsettling, but nice",the robot being collaborative encouraged me to more collaborative and less competitive in the end,"maybe it was getting more collaborative as the game progressed, but I am not sure","not really. I tried to be collaborative whenever I had the occasion, but when i was able to do a single win I was doing it anyway.",It was very clear overall.,"It was my first interaction with a robot, I would say I would be more comfortable next time!",NO,7 (fully understood),7 (very friendly),7 (very playful),4,7 (very team-like),6,5,6,5,6,7 (very friendly),5,6,6,6,5,6,1 (not at all),4,6,7 (very responsive),5,4,5,7 (agree),5,7 (agree),5,7 (agree),7 (agree),5,6,7 (agree),Nothing really,1 (not familiar),None,"Be more collaborative, and less competitive",,
4/20/2014 15:09:00,"Not particularly competitive. There were a few times (twice I think) where Glados could have taken a single win, and didn't.",Not sure that I felt anything about Glados. ,"I noticed that Glados gave me a card every now and then, so I tried to cooperate with it as well. However, I felt like getting to a team win was actually pretty difficult (as each donation costs you a foregone draw).",Not really. Perhaps a slight tendency towards more altruism.,"As I said above, I tried to go for team wins initially, but then noticed that this seems to be a losing strategy. So I switched towards single wins.",No.,Not in any way that I am aware of right now.,NO,7 (fully understood),6,4,4,7 (very team-like),3,4,4,4,4,5,4,6,5,4,3,4,1 (not at all),2,4,2,2,3,3,6,5,3,4,3,6,2,5,3,Nothing that I can think of right now.,3,"I took a psychology class last semester (social psychology seminar), but I have not participated in (or conducted) any experiments before.",Hmm. I can't think of anything.,Yes (finals and term papers...).,
4/20/2014 15:18:01,"Not very competitive, he declined various opportunities to take a single win.",He seemed pretty human - his head movements reminded of a human noding and showing appreciation.,It didn't really affect it. I just looked at him and checked out his movements. ,It changed towards a more social gaming style. He didn't offer any cards in the beginning but started doing so towards the end. ,I aligned it with Kuka's style. I offered some cards in the beginning but as that wasn't returned I stopped doing it until Kuka started doing it as well. Hence I played in what I would call adaptive style. ,No technical difficulties. I found the game rather strange since there was this trade-off between a team win and a single win.,N/A,NO,5,5,4,5,4,2,2,6,6,6,5,7 (very team-like),6,5,6,3,6,1 (not at all),5,3,5,1 (none),5,2,6,7 (agree),4,6,7 (agree),5,4,6,7 (agree),I don't see why there would be a seperation between Glados and Kuka. It would feel more natural to play only against Glados.,5,I have participated in various behavioral economics experiments - I have also conducted one experiment of my one.,"Play with fake stakes, no actual money but a more sophisticated point scoring system.","No, I wouldn't. ",
4/20/2014 15:40:49,not at all. Never used his opportunitites to go for a single win!,I could not really make sense about his playing style. Whether he was attempting to win at all or not. I also tried to achieve a team win but even though I cooperated for a while I never had the chance,Definitely made me sharing more cards as the game progressed,No sorry I did not. Certainly did not become less cooperative as I went for the single win several times,I started off by never changing cards to trying to share in an attempt to win a team win as I saw that Kuka never took the single win. As we never got even close I acted egoistically again,No,I am not really sure I understand how Kuka made his decision,NO,5,7 (very friendly),5,5,7 (very team-like),3,1 (not clever),7 (very sincere),7 (very fair),7 (very honest),2,3,6,6,4,2,2,1 (not at all),1 (not at all),2,3,3,3,3,3,5,2,6,6,4,1 (disagree),6,5,nope. i wish I would have had the opportunity for a team win or see glados go for a single win at least once,6,Conducted game theory and psychology experiments in the past,Stop confusing me by making sure that glados goes for the win if possible,No,