Please enter your identification number.,How competitive did you feel GLaDOS was?,How did you feel about GLaDOS?,"Describe how your interaction with GLaDOS affected your style of play, if at all?","Did you recognize a change in Kuka's play style as the game progessed, if yes, how did it change?","Did you change your play style as the game progressed? If yes, in what way did it change? Why?",Was there anything unclear about the experiment? Was there anything confusing about the game? Were there any technical difficulties?,"Has this experiment changed your perception of feeling about robots in any way? If so, how?",I have played this game before:,I understood the rules of the game I was playing:,How would you rate GLaDOS in terms of friendliness?,How would you rate GLaDOS in terms of playfulness?,How would you rate GLaDOS in terms of entertainment?,How would you rate GLaDOS in terms of teamwork?,How would you rate GLaDOS in terms of intelligence?,How would you rate GLaDOS in terms of cleverness?,How would you rate GLaDOS in terms of sincerity?,How would you rate GLaDOS in terms of fairness?,How would you rate GLaDOS in terms of honesty?,How would you rate yourself in terms of friendliness?,How would you rate yourself in terms of teamwork?,How would you rate yourself in terms of intelligence?,How would you rate yourself in terms of cleverness?,How would you rate yourself in terms of sincerity?,How would you rate yourself in terms of fairness?,How would you rate yourself in terms of honesty?,How often did you speak to GLaDOS during the game?,How often did you want to speak to GLaDOS during the game?,How would you rate how well GLaDOS played the game?,How responsive was GLaDOS to you?,To what extent did you feel you could interact with GLaDOS?,How natural was the interaction with GLaDOS?,How much control over the interaction did you fell you had?,"If I were playing as part of a team, I  would want GLaDOS on my team.",I adjusted my playing style to be equal to my opponent.,GLaDOS improved at the game over time.,I would like GLaDOS to be a friend of mine.,I would like to talk to GLaDOS.,"I GLaDOS were feeling bad, I'd try to cheer GLaDOS up.","GLaDOS makes me feel comfortable, as if I am with a friend.",I like GLaDOS.,I'd like to play with GLaDOS again.,Anything else you want to tell us?,How familiar are you with psychology research?,Please describe your previous familiarity with psychology research,What changes could be made to this experiment to improve your experience as a player?,"Were you in a rush when you performed the experiment? If so, why.",
1,Not very competitive,No feeling!,If it had given me a card I felt a bit guilty not giving one back,Gave more cards,No- I just thought about it more as i got used to it,No,No,NO,7 (fully understood),6,4,3,7 (very team-like),5,2,7 (very sincere),7 (very fair),7 (very honest),4,3,5,5,7 (very sincere),7 (very fair),7 (very honest),1 (not at all),5,3,2,2,2,1 (none),1 (disagree),1 (disagree),1 (disagree),1 (disagree),1 (disagree),7 (agree),1 (disagree),4,2,no,1 (not familiar),This is the only thing I've done related to psychology resaearch,Maybe make it a bit more competitive?,,1
2,Very non-competitive. GLaDOS seemed to place the team win as priority and would rather let a round go without a winner than going for a single win...unlike me.,Either GLaDOS is a team player or is just not that smart. He is programmed to play very unselfishly.,"Initially it seemed GLaDOS  didn't give any cards to me so I took single wins whenever I could. But after winning a couple, I started to try to wait for a team win.
After some rounds passed with no winner, I decided to just go for single wins whenever I could.",It seemed to give me cards too and it didn't go for single wins,"Initially I thought we were both going for the wins so I started off going for single wins. After I noticed that GLaDOS didn't go for single wins, I also tried to do the same then I switched back again to single wins.",I had trouble donating the right cards - whenever I tried to give a card that wasn't the first one from the left it wouldn't work and I'd find that I had donated the first card to the left and not the one I intended.,"Slightly. Whilst I was playing the game, I felt sorry for GLaDOS  and wanted us to both win but then I realized that it was just programmed that way.",NO,5,7 (very friendly),3,2,7 (very team-like),2,2,4,7 (very fair),7 (very honest),2,1 (not team-like),4,4,5,5,6,1 (not at all),7 (very often),1 (poorly),1 (not responsive),1 (none),3,1 (none),1 (disagree),4,1 (disagree),6,1 (disagree),7 (agree),2,6,2,I mentioned the trouble I had giving away the right cards - maybe it was my problem only but you may want to check this,2,Took part in random surveys and took only and intro psych class,"Be able to suggest moves to GLaDOS.
Make GLaDOS a bit more selfish (or smarter?)",,2
3,"I didn't feel that GLaDOS was competitive. There were chances when it could have taken the single win, but instead chose to continue to draw cards. I'm not entirely sure if it was aiming for team wins. It seemed as though single wins were easier to obtain anyway.","I felt that GLaDOS was an interesting, but boring competitor. However, it probably serves better as a teammate. The interaction I had with it felt very one-dimensional.","At first it made me feel very competitive because its presence made the game seem challenging. It made it initially feel like more strategy than luck was involved. However, as the game proceeded, I was relying almost entire on luck of the draw and became a little uninterested in the end.","I noticed that it started to give me cards, which it did not do towards the beginning.","Towards the beginning, I felt as if maybe giving away cards would be part of a winning strategy, which for team wins it is. But I aimed to get single wins so I strayed away from that as the game progressed. ","I didn't realize that the card in the middle would change every time a new card is drawn, but I might not have been paying close attention during the instructions. ","It has not changed my perception in any way. I felt like this experience could equal when I play a random game on my computer. It's fine at first to arbitrarily pass the time, but I become uninterested after a certain point.",NO,6,4,1 (not playful),3,6,4,3,1 (not sincere),5,5,6,2,5,5,6,6,6,3,7 (very often),4,2,2,2,2,4,5,5,1 (disagree),1 (disagree),1 (disagree),1 (disagree),4,2,No,3,I am not very familiar with psychology research.,Perhaps the game could have been more entertaining like have an incentive for single wins vs team wins or to have a background story with the game. I feel like card games are meant to be played amongst friends since the games serve more as a platform for conversation and fun rather than just a game itself.,,3
4,Not very competitive.,"The robot slightly imitates human behavior in that you can have the impression that he 'looks' nat you once in a while, so I felt a little more connected or interested as if it was only a machine. But the movements are very similar and repetitive, so it looks 100% automated.","Because it was a machine and the game only about numbers it made my behavior more competitive, more focused on my own gain/win than on the robots situation. If it had been a human or a 'real life' situation where my win situation actually affects that of another human being my behavior would have been more cooperative.",No,"Yes, I did not have a clear or logic strategy. In the beginning I took all the single-win options. In the end I decided to donate more cards and did not take every single-win option.",No,No,NO,6,1 (not friendly),1 (not playful),1 (not entertaining),1 (not team-like),1 (not intelligent),1 (not clever),1 (not sincere),2,1 (not honest),4,2,6,5,3,2,6,1 (not at all),1 (not at all),2,1 (not responsive),1 (none),1 (not natural),1 (none),1 (disagree),1 (disagree),2,1 (disagree),1 (disagree),1 (disagree),1 (disagree),2,1 (disagree),No,4,Have participated in one psychology experiment at a different university. Learned about experiemental design in political science classes.,Have more information as to how I can or cannot influence GLaDOS behavior. It was not clear to me whether GLaDOS was changing his strategy or whether he was only automatically playing- maybe this lack of information was intended however for this experiment.,No,
5,Not very competitive,Adorable. Nice.,"Sometimes when GlaDOS gave me cards, I reciprocated.  Especially when it moved around.",Not really,"I became a bit less competitive, and gave more cards.  ",Nope.,No.,NO,7 (fully understood),6,6,6,5,2,2,4,5,4,5,6,6,6,7 (very sincere),6,7 (very honest),4,4,2,4,5,5,4,5,3,2,4,5,6,6,7 (agree),3,Nope,7 (very familiar),"I have a B.S. in Psychology (Neuroscience). Have conducted fMRI studies, taken many psychology classes, and participated in numerous studies.   ",Longer head phones.  ,,5
6,Not entirely competitive; didn't take several single wins.,I think you guys are watching me from a back room.,Not at all.,I think Kuka may have been taking more time.,Nope.,Unclear whether kuka is programmed or whether you're controlling it from a back room.,no.,NO,5,2,1 (not playful),2,1 (not team-like),2,1 (not clever),1 (not sincere),4,1 (not honest),1 (not friendly),4,6,6,7 (very sincere),6,6,1 (not at all),1 (not at all),4,2,4,1 (not natural),1 (none),4,2,1 (disagree),1 (disagree),4,1 (disagree),1 (disagree),4,2,I have to wonder if somebody in a back room could have heard me if I spoke.,2,none,none,Yes- lots of work to do.,6
7,not really,it is pretty cute,"in the beginning, i was not sure its personality. then i realized that it was not being competitive, so i aimed for the both win situation.",not really,"yes. i was more selfish in the beginning, trying to win the game. yet after realizing glados has a naive personality. i decided not to be aggressive at all, and aimed for both win situation. ","it was all clear. however, i encountered a little technical problem which i failed to check the box i wanted a few times. but it was not a big problem and did not really effect the entire experiment, i think.",not really. ,NO,7 (fully understood),7 (very friendly),4,5,7 (very team-like),4,3,7 (very sincere),7 (very fair),7 (very honest),6,6,5,6,7 (very sincere),7 (very fair),6,1 (not at all),2,6,6,6,5,3,7 (agree),7 (agree),4,4,4,5,4,7 (agree),7 (agree),"i did not speak to glados, but i made faces to it. i thought i am not allowed to speak during this kind of game.",3,heard about how it was done from friends but did not participate in any academic psychology before.,"it is fun. but i think since one of your questions is about talking to glados, the experiment can be done in a room with only glados, because i would not want to disrupt anyone else in the room. ",no.,
8,Not at all competitive - did not try to take single wins even when I knew it could.,"Felt that GLaDOS made the game longer at times by not trying to win, so GLaDOS was more cooperative than competitive. I think GLaDOS is a cool robot, though.","Not sure it did because I'm unsure if GLaDOS really ""saw"" me when it looked at me.",Who is Kuka? If you mean GLaDOS then no.,"I tried to be more cooperative and wait for team wins rather than take individual wins towards the middle as I realized GLaDOS did not try to make single wins, but towards the end I went for more single wins as I got impatient with that fact.",It's just unclear to me as to what I'm supposed to assume GLaDOS's motives are.,"Yes, I think they're even cooler now!",NO,6,4,4,5,7 (very team-like),6,6,4,6,4,4,3,6,6,4,4,4,1 (not at all),2,3,2,2,1 (not natural),1 (none),5,2,1 (disagree),5,7 (agree),7 (agree),5,7 (agree),4,N/A,6,Have taken PSYCH 101 and participated in pysch research studies before. Have also done some clinical pysch research assistant work.,Tell the player they should attempt to interact with GLaDOS.,No.,
9,Not competitive at all.,GLaDOS did not make intelligent decisions.,It did not affect my playing style.,"No, I noticed no changes.","No, I didn't change anything.","No, I was just confused about why GLaDOS didn't take any single wins when it had the opportunity.",Not really.,NO,5,5,4,3,4,2,2,5,5,5,6,5,5,5,6,6,6,1 (not at all),2,2,2,3,3,3,3,1 (disagree),1 (disagree),3,3,6,3,6,4,Nothing.,6,"I've taken one psych class in college, and have been involved in other Yale studies.",Nothing!,"No, not at all.",
10,not so much,it moved a lot which I found funny,"I didn't feel I had interactions with it. Unless I wasn't sure if it was trying to intimidate me while ""looking at me"" or just looking at me.
I noticed quite late that it was responsive as I was looking at it, so I began to smile at it but that's it.",yes it gave me less and less cards,"at first I didn't give him lots of cards because I was aiming single wins, but then since I didn't find him much competitive I gave him more and I tried to make team wins.","I must admit that I didn't get whether single wins were more important than team wins, and also at first I didn't get that ""giving a card"" meant giving it to the robot
I also didn't get if the robot could make single wins too.","I would not say that but that's the first time I play with a robot that I can see and I thought it was funny, I wish I could start over and try to make more team wins and interactions",NO,5,4,6,5,3,6,4,4,4,4,4,4,6,5,6,5,6,1 (not at all),5,5,6,3,3,4,4,6,2,3,5,4,1 (disagree),5,7 (agree),I feel stupid I didn't get that I had power to make the robot move more ! I would have tried some stuff,1 (not familiar),none,"could be a bit more specific about the rules, like showing an entire set ",not so much but I was more focused on the game than on my interactions with the robot,
11,GLaDOS was quite competitive. He was using reacting differently throughout the game. ,"At first, I treated it as if I were playing a computer and did not pay attention to his moves as much as I just did to mine. However, I felt our results were improving once I started thinking of him as a rational player and really analyzing his decisions. ","I would see what decisions GLaDOS made depending on what situation we were in. I tried understanding why and when he would pass cards to me and once I saw him doing that more often in certain circumstances, I also started giving him more cards and not taking single wins immediately in an attempt to get team wins. ",I do not think it changed,"It did change - I did not immediately take the single wins,. instead would take the gamble and try to reach team wins through passing cards and drawing new ones. ","I think the instructions are clear and there were no technical difficulties. I think the game strategy is unclear at the beginning, but that is something each player has to figure out simply by playing. ",No it did not impact my feelings about robots ,NO,7 (fully understood),5,4,5,3,3,4,1 (not sincere),5,5,5,4,5,5,5,5,6,1 (not at all),4,5,4,2,2,3,5,5,5,1 (disagree),1 (disagree),1 (disagree),1 (disagree),6,4,Nothing more ,1 (not familiar),N/A,None,I was not ,
12,Not too competitive,Mostly neutral; a little amused,Not all that much. I don't know how else I was supposed to have interacted with GLaDOS aside from occasionally looking over as the next move was about to be made. ,No,"Yes -- at first I just took the single win whenever I had the opportunity, but as the game progressed I wanted to wait a little longer and see if we could manage a team win.",,"I don't believe I've ever participated in an experiment with robots before. So this was cool. I'm not sure if my ""perception"" has changed significantly.",NO,4,4,4,5,5,4,5,3,6,5,6,6,4,3,5,6,7 (very honest),1 (not at all),3,4,4,2,3,2,5,5,5,5,7 (agree),4,4,5,5,No. I guess this was cool. If I had known of any other ways in which I could interact with GLaDOS I probably would have tried it out to see what would happen.,3,"-Participated in research study
-Worked as an assistant for a psychology professor (my work didn't have too much to do with psychology/research, but did a little bit of lit review and data analysis)",Easy access to instructions as game is being played,No,
14,"Quite a bit, at the start",Viewed him initially as an opponent,My choices were based slightly off what he did,He became more team - oriented,I declined more single wins for a team one. ,Not really,Not really!,NO,6,4,4,3,5,4,4,5,6,4,4,2,6,5,5,4,5,1 (not at all),2,4,5,4,4,4,4,5,5,3,1 (disagree),3,1 (disagree),2,4,Good job!,3,Taken psychology and conducted some very basic stress and memory experiments,Nothing much ,No,
15,Not at all. When given the opportunity for a single win she did not take it. I felt like her goal was to help us both win.,I felt that Glados was trying to help me. ,"When Glados made gestures such as nodding or looking up or to the side it gave her a sort of personality that I enjoyed, but was unsure of what it meant. ",As the game went on it seemed more willing to donate cards.,"At first I wanted to try to get double wins, but eventually realized that getting single wins was much easier, so unless I had three of the same cards would not pass up taking a single win. If I though a double win was possible I would pass up a single win, even towards the end. ","Everything was pretty clear, except how it was scored. ","My perceptions of robots have not really changed. I was surprised, however, that a robot, especially one without any human like features, could appear to have a personality, with its random movements, nods etc. ",NO,5,6,5,5,6,3,3,5,6,6,3,4,5,5,6,6,5,1 (not at all),6,4,2,3,1 (not natural),3,2,3,3,4,5,6,2,6,4,no,6,Have taken a psychology class and participated in several psychology research studies,"Perhaps more or clearer instruction, though these weren't a big problems ",No.,
16,Not competitive at all... I felt that GLaDOS did not take opportunities to take a single win even when it was clear that it was a single win situation. ,GLaDOS seemed very interesting and it was amazing to watch it make a move before it submitted its decision. ,Did not affect style of play at all. ,"I didn't recognize an obvious change, but as I mentioned before, it did seem like Kuka did not take opportunities to win a single win. ","Yes, I tried to help Kuka sometimes because I felt bad. ","Yes, even when I didn't select a card to give to Kuka, the game still gave my first card to Kuka if I hit the ""Give card"" button. Maybe this should be fixed so that a user only can give a card if they specifically select one beforehand. ","No, but it is interesting to see a robot in action. ",NO,7 (fully understood),4,3,4,5,5,2,3,3,4,5,5,5,5,6,5,5,1 (not at all),4,2,4,1 (none),2,2,1 (disagree),5,2,3,5,6,2,4,5,N/A. ,2,I have no prior familiarity with psychology research besides papers and books I have read. ,Interactions with GLaDOS perhaps?,No. ,
103,"I don't feel like he was that competitive. Since I didn't know what Glados had in his hand, there wasn't much incentive to give him cards, and I ended up drawing cards every turn. I had 9 single wins while Glados didn't have any, but I feel like the likelihood of him not having any while I had 9 is pretty slim, so it would seem to me that he didn't seize his chances to take single wins.","I realized after a few games that he wasn't pressing buttons some of the time, so I felt like his physical actions didn't have real consequences in the game. However, I liked his various realistic motions (i.e. looking into the screen, leaning back out of the screen, attempting to hit buttons--the keyboard shifted a few times so he was missing them some of the time, and especially looking at me). These motions made it feel more realistic.","I originally thought that the camera might have served some purpose, like he was looking at the screen, and making his move based on that. However, once I realized that he wasn't striking buttons every turn and his physical actions didn't have consequences in the game, I felt like the camera was more for aesthetic than game play. Still, I think it added an extra element of personality and personableness to him. In short, it didn't affect my style of play, but I did like all his little motions.",I didn't recognize a change in play.,"Mostly no, but I did start out hoping to get team wins more than single wins. But after a few rounds with no luck, I thought that there was little likelihood for team wins, so I went for single wins when I had the chance. Other than that, there was no big difference as the game progressed.","Not really. Glados occasionally didn't hit keys when it seemed like he was supposed to, but maybe he wasn't at those times. He also shifted the keyboard occasionally with his sweeping motion.","I think the realistic motions (listed above) were great and I found them engaging. Even a robot like Glados, which isn't very human-like, can have certain motions that give him a personality, which is cool. I think if I felt like he actively changed the outcome of the game, I would have been more connected to him. But his head nods, looking at me, etc. was very personable.",NO,6,5,6,6,3,4,4,5,4,4,5,5,5,5,6,6,6,1 (not at all),3,4,5,4,5,3,4,4,3,5,5,5,5,6,6,n/a,5,"Took intro psych, participated in psych studies before","I noted this in an above field--I think if I felt like Glados actively changed the outcome of the game, I would have been more connected to him.",Not really.,
104,Not very competitive.,I felt that Glados was kind of unlucky in his card draws. ,"Glados kept ""looking"" at me, which made me kind of empathize with the fact that it wasn't winning. Towards the end, I definitely started giving humano-centric characteristics. These feelings affected my play because I gave up two single-win opportunities and donated cards to it, hoping that it would win at least one round. ","No, I did not notice any change in style.","Yes. I tried to give Glados more chances to win, instead of taking mostly single wins for myself.",No.,No.,NO,7 (fully understood),5,5,4,4,6,2,4,4,4,4,4,4,4,6,5,5,5,6,3,3,4,3,4,3,3,1 (disagree),6,6,7 (agree),5,7 (agree),4,Nope.,1 (not familiar),I haven't done any research of this kind before. I haven't played with robots before either. ,Responsive of Glados could be improved. ,"Yes, I have an event to attend after this. ",
105,"Not competitive. There was at least one game where I kept track of the cards and GLaDOS could have taken a single win, but it chose not to.",Neutral. I don't think it ever made any choice except to draw another card.,It did not affect my style. Mostly I chose to take the opportunities for single wins so the game could end sooner.,"I saw no change - as mentioned above, I believe it only ever chose to draw another card (maybe I missed something, though).","At first I wondered if I should try to get a team win, but pretty soon I decided I just wanted to finish as fast as possible. Besides, Kuka did not seem competitive even though I guess I could have been perceived as competitive.","Very clear, no confusion.","Not really. I guess I wouldn't perceive this robot as being particularly smart if the point was to be competitive, but perhaps it was not programmed to be competitive.",NO,7 (fully understood),4,3,1 (not entertaining),4,3,1 (not clever),4,4,5,3,2,5,4,4,3,5,1 (not at all),1 (not at all),2,1 (not responsive),1 (none),1 (not natural),2,1 (disagree),1 (disagree),1 (disagree),1 (disagree),1 (disagree),1 (disagree),2,3,4,"I didn't particularly feel an ""interaction"" with GLaDOS - it seemed kind of random or not responsive.",3,"I took Introduction to Psychology, and I had to participate in a couple of research studies (as a subject) for that class.",I thought it was fine.,"I was not really in a big rush, but it was not very interesting, partly because the robot always made the same non-competitive choice, so I didn't see why I should draw it out.",
106,Not very competitive,"he was pushing the same button. I was unsure if he can make the ""choice"" of donating cards as well. was a little weird to have him constantly move",there was not much interaction. but he seemed happy when we got a group win which could potentially increase my team win behavior. When he stares at you ones you take a single win you feel bad,no,it took some time for me to figure out how to select a card to give it,"yes, I had  trouble selecting the cards",feels weird to have them around,NO,5,4,5,3,3,2,2,3,3,4,4,3,2,2,4,3,4,1 (not at all),2,2,4,3,3,2,3,1 (disagree),4,2,3,6,2,4,4,make glaados push different buttons,6,"taken classes, been participant,read books and papers",the interface could be clearer,tired,
108,I feel that it was not competitive at all.,I don't think it was actually playing with me. I think it was just hitting certain buttons at random and that they actually did nothing.,I felt like it wasn't really playing with me. I think it was just doing a set of movements that it was programmed to do.,I think it nodded at me once when I took a single win.,At first I wanted to beat it but towards the end I wanted to have a team win because I felt I was beating it pretty badly so I felt sorry for it even though it is a robot. ,Maybe you should explain the game a little better by showing more examples.,No not really. I still feel that they are just machines without any human characteristics.,NO,5,5,3,5,1 (not team-like),2,1 (not clever),5,7 (very fair),7 (very honest),4,2,7 (very intelligent),7 (very clever),7 (very sincere),2,6,1 (not at all),1 (not at all),1 (poorly),3,2,3,2,2,1 (disagree),1 (disagree),3,2,1 (disagree),2,3,2,I don't think GLaDOS was really thinking. It was just running through a program installed in it.,5,I am dating a psychologist and I have partook in studies before. ,Stress that you are to play as a team more that by yourself.,no rush.,
